Sequence	BLAST	Pfam	Prosite	ALL_OTHER_ANNOTATIONS	Comments
ABO13661	Inner membrane transport protein YnfM;	Major Facilitator Superfamily	Major facilitator superfamily (MFS) profile.	GO:0016021;GO:0005886;GO:0005215;GO:0055085	Major facilitator inner cell membrane protein
ABO13662	Cell wall formation. Catalyzes the transfer of a GlcNAc  subunit on undecaprenyl-pyrophosphoryl-MurNAc-pentapeptide (lipid  intermediate I) to form undecaprenyl-pyrophosphoryl-MurNAc-  (pentapeptide)GlcNAc (lipid intermediate II). {ECO:0000255|HAMAP-  Rule:MF_00033}.	null	null	GO:0005886;GO:0051991;GO:0050511;GO:0005975;GO:0007049;GO:0051301;GO:0071555;GO:0030259;GO:0009252;GO:0008360	Potentially involved in cell wall formation
ABO13666	Putative quercetin 2,3-dioxygenase. {ECO:0000250}.	This family consists of Pirin proteins from both eukaryotes and prokaryotes. The function of Pirin is unknown but the gene coding for this protein is known to be expressed in all tissues in the human body although it is expressed most strongly in the liver and heart. Pirin is known to be a nuclear protein, exclusively localised within the nucleoplasma and predominantly concentrated within dot-like subnuclear structures [<a href="#ref1">1</a>]. A tomato homologue of human Pirin has been found to be induced during programmed cell death [<a href="#ref2">2</a>]. Human Pirin interacts with Bcl-3 and NFI [<a href="#ref3">3</a>] and hence is probably involved in the regulation of DNA transcription and replication. It appears to be an Fe(II)-containing member of the Cupin superfamily.	null	GO:0046872;GO:0008127	Pirin family gene with unknown function potentially involved in Flavonoid metabolism
ABO13667	Probable hydrolase	This family are hydrolase enzymes.	null	GO:0005829;GO:0016020;GO:0016787;GO:0008152	Probable hydrolase
ABO13246	Porin. Induces apoptosis in human cells through  caspases-dependent and AIF-dependent pathways. Purified Omp38  enters the cells and localizes to the mitochondria, which leads to  a release of proapoptotic molecules such as cytochrome c and AIF  (apoptosis-inducing factor) (By similarity). {ECO:0000250}.	In molecular biology, the OmpA domain is a conserved protein domain with a beta/alpha/beta/alpha-beta(2) structure found in the C-terminal region of many Gram-negative bacterial outer membrane proteins, such as porin-like integral membrane proteins (such as ompA), small lipid-anchored proteins (such as pal), and MotB proton channels.	OmpA-like domain profile.	GO:0009279;GO:0046930;GO:0015288;GO:0006811	Outer memebrane protein associated with family involved in protein translocation, as well as signal transduction among other functions
ABO10773	Catalyzes the final step of fatty acid oxidation in which acetyl-CoA is released and the CoA ester of a fatty acid two carbons shorter is formed. {ECO:0000255|HAMAP-Rule:MF_01620}.	Thiolase is reported to be structurally related to beta-ketoacyl  synthase (<a href="http://pfam.xfam.org/family/PF00109">PF00109</a>), and also chalcone synthase.	Thiolases acyl-enzyme intermediate signature.	GO:0005737;GO:0003988;GO:0006635	Thiolase potentially involved in final step of fatty acid oxidation
ABO13643	Transport of potassium into the cell.  {ECO:0000255|HAMAP-Rule:MF_01522}.	This is a family of K+ potassium transporters that are conserved across phyla, having both bacterial (KUP) <a class="ext" href="http://www.uniprot.org/entry/P30016">P30016</a> [<a href="#ref3">3</a>] yeast (HAK)  <a class="ext" href="http://www.uniprot.org/entry/P50505">P50505</a> [<a href="#ref2">2</a>] and plant (AtKT) <a class="ext" href="http://www.uniprot.org/entry/O22397">O22397</a> [<a href="#ref1">1</a>] sequences as members.	null	GO:0016021;GO:0005886;GO:0015079	K+ potassium transporter protein
ABO12769	Removes the pyruvyl group from chorismate, with  concomitant aromatization of the ring, to provide 4- hydroxybenzoate (4HB) for the ubiquinone pathway.  {ECO:0000255|HAMAP-Rule:MF_01632}.	Chorismate lyase catalyses the first step in ubiquinone synthesis, i.e. the removal of pyruvate from chorismate, to yield 4-hydroxybenzoate.	null	GO:0005737;GO:0008813;GO:0006744	Chorismate lyase catalyses the first step in ubiquinone synthesis
ABO13422	Catalyzes the reversible oxidation of malate to  oxaloacetate. {ECO:0000255|HAMAP-Rule:MF_01517}.	L-lactate dehydrogenases are metabolic enzymes which catalyse the conversion of L-lactate to pyruvate, the last step in anaerobic glycolysis. L-2-hydroxyisocaproate dehydrogenases are also members of the family.  Malate dehydrogenases catalyse the interconversion of malate to oxaloacetate. The enzyme participates in the citric acid cycle. L-lactate dehydrogenase is also found as a lens crystallin in bird and crocodile eyes. N-terminus (this family) is a Rossmann NAD-binding fold. C-terminus is an unusual alpha+beta fold.	null	GO:0030060;GO:0005975;GO:0006108;GO:0006099	Malate dehydrogenase involved in creation of pyruvate in last step of anaerobic glycolysis
ABO13472	Binds the lower part of the 30S subunit head. Binds mRNA  in the 70S ribosome, positioning it for translation.  {ECO:0000255|HAMAP-Rule:MF_01309}.	This family contains a central domain <a href="http://pfam.xfam.org/family/PF00013">PF00013</a> hence the amino and carboxyl terminal domains are stored separately. This is a minimal carboxyl-terminal domain.      Some are much longer.	Type-2 KH domain profile.	GO:0015935;GO:0019843;GO:0003735;GO:0006412	Ribosomal S3 subunit
ABO13454	With S5 and S12 plays an important role in translational	This family includes small ribosomal subunit S9 from prokaryotes and S16 from metazoans.  This domain is predicted to bind to ribosomal RNA [<a href="#ref1">1</a>].  This domain is composed of four helices in the known structure.  However the domain is discontinuous in sequence and the alignment for this family contains only the first three helices.	Ribosomal protein S4 signature.	GO:0015935;GO:0019843;GO:0003735;GO:0006412	Ribosomal S family subunit
ABO13054	Catalyzes the oxidation of erythronate-4-phosphate to 3-  hydroxy-2-oxo-4-phosphonooxybutanoate. {ECO:0000255|HAMAP-  Rule:MF_01825}.	This domain is inserted into the catalytic domain, the large dehydrogenase and D-lactate dehydrogenase families in SCOP. N-terminal portion of which is represented by family <a href="http://pfam.xfam.org/family/PF00389">PF00389</a>.	D-isomer specific 2-hydroxyacid dehydrogenases NAD-binding signature.	GO:0005737;GO:0033711;GO:0051287;GO:0046983;GO:0008615	Dehydrogenase potentially involved with NAD binding
ABO13453	DNA-dependent RNA polymerase catalyzes the transcription  of DNA into RNA using the four ribonucleoside triphosphates as  substrates. {ECO:0000255|HAMAP-Rule:MF_00059}.	The alpha subunit of RNA polymerase consists of two independently folded domains, referred to as amino-terminal and carboxyl terminal domains.  The amino terminal domain is involved in the interaction with the other subunits of the RNA polymerase.  The carboxyl-terminal domain interacts with the DNA and activators.  The amino acid sequence of the alpha subunit is conserved in prokaryotic and chloroplast RNA  polymerases.  There are three regions of particularly strong  conservation, two in the amino-terminal and one in the carboxyl- terminal [<a href="#ref2">2</a>].	null	GO:0003677;GO:0003899;GO:0046983;GO:0006351	Alpha subunit RNA polymerase helps catalyzes the transcription of DNA into RNA
ABO11298	Interacts with and stabilizes bases of the 16S rRNA that are involved in tRNA selection in the A site and with the mRNA backbone. Located at the interface of the 30S and 50S subunits, it traverses the body of the 30S subunit contacting proteins on the other side and probably holding the rRNA structure together. The combined cluster of proteins S8, S12 and S17 appears to hold together the shoulder and platform of the 30S subunit.	This protein is known as S12 in bacteria and archaea and S23 in eukaryotes.	Ribosomal protein S12 signature.	GO:0015935;GO:0019843;GO:0003735;GO:0000049;GO:0006412	Ribosomal S12 protein Interacts with and stabilizes bases of the 16S rRNA that are involved in tRNA selection in the A site and with the mRNA backbone
ABO11199	NDH-1 shuttles electrons from NADH, via FMN and iron-  sulfur (Fe-S) centers, to quinones in the respiratory chain. The  immediate electron acceptor for the enzyme in this species is  believed to be ubiquinone. Couples the redox reaction to proton  translocation (for every two electrons transferred, four hydrogen  ions are translocated across the cytoplasmic membrane), and thus  conserves the redox energy in a proton gradient.  {ECO:0000255|HAMAP-Rule:MF_01351}.	Superfamily includes proteins containing  domains which bind to iron-sulfur clusters. Members  include bacterial ferredoxins, various dehydrogenases, and various reductases.  Structure of the domain is an alpha-antiparallel beta sandwich.	4Fe-4S ferredoxin-type iron-sulfur binding domain profile.	GO:0005886;GO:0051539;GO:0046872;GO:0016651;GO:0048038	Binds to Iron-Sulfur clusters to shuttle eletrons from NADH to quinones in the respiratory chain(ubiquinone electron acceptor)
ABO10787	Catalyzes the phosphorolysis of diverse nucleosides,  yielding D-ribose 1-phosphate and the respective free bases. Can  use uridine, adenosine, guanosine, cytidine, thymidine, inosine  and xanthosine as substrates. Also catalyzes the reverse  reactions. {ECO:0000255|HAMAP-Rule:MF_01537}.	This family consists of several conserved hypothetical bacterial proteins of around 95 residues in length. The function of this family is unknown	null	GO:0047975;GO:0016154;GO:0009032;GO:0004850	Catalyzes the phosphorolysis of diverse nucleosides, part of unknown family in Pfam database
ABS90132	This methylase protects the DNA from cleavage by the HphI endonuclease.	null	null	GO:0003886;GO:0009307	Potential methylase that protects DNA from Hphl endonuclease cleavage 
ABS90223	Part of the high-affinity ATP-driven potassium transport  (or Kdp) system, which catalyzes the hydrolysis of ATP coupled  with the electrogenic transport of potassium into the cytoplasm.  This subunit binds and transports the potassium across the  cytoplasmic membrane. {ECO:0000255|HAMAP-Rule:MF_00275}.	null	null	GO:0016021;GO:0005886;GO:0008556	Potentially involved in ATP-driven potassium transport (or Kdp) system moving potassium into cytoplasm 
ABS90242	Transfers the N-acyl diglyceride group on what will  become the N-terminal cysteine of membrane lipoproteins.  {ECO:0000255|HAMAP-Rule:MF_01147}.	null	null	GO:0016021;GO:0005886;GO:0016757;GO:0042158;GO:0009249	Potentially transfers the N-acyl diglyceride group on what will become the N-terminal cysteine of membrane lipoproteins.